Sheet: BOM
B2: Project : | C2: Gmic | F2: V1.1
B3: https://github.com/JonathSpirit/Gmic
B4: Author : Guillaume Guillet | E4: Revision 1 | F4: Licensed under CERN-OHL-W v2 or later
A6: Type | B6: Value | C6: Q | D6: References | E6: Package | F6: Manufacturer | G6: Store | H6: Store ID | I6: Unit price* | J6: Price
A7: C | B7: 1uF | C7: 7 | D7: C9, C11, C15, C17, C19, C22, C23 | E7: C_0805_2012Metric | F7: KEMET | G7: Mouser | H7: 80-C0805C105K4R7210 | I7: 0.131 | J7: of:=[.I7]*[.C7] -> 0.917
B8: 100nF | C8: 9 | D8: C3, C5, C7, C10, C14, C16, C18, C21, C24 | E8: C_0805_2012Metric | F8: KEMET | G8: Mouser | H8: 80-C0805C104J5RACLR | I8: 0.186 | J8: of:=[.I8]*[.C8] -> 1.674
B9: 100pF | C9: 3 | D9: C4, C6, C8 | E9: C_0805_2012Metric | F9: KEMET | G9: Mouser | H9: 80-C0805C101G5HACTU | I9: 0.149 | J9: of:=[.I9]*[.C9] -> 0.447
B10: 2.2uF | C10: 5 | D10: C1, C2, C12, C13, C20 | E10: C_0805_2012Metric | F10: KEMET | G10: Mouser | H10: 80-C0805C225K8PAC | I10: 0.177 | J10: of:=[.I10]*[.C10] -> 0.885
A11: MK | B11: CMC-9745-44P | C11: 2 | D11: MK1, MK2 | E11: CMC974544P | F11: CUI Devices | G11: Mouser | H11: 490-CMC-9745-44P | I11: 0.744 | J11: of:=[.I11]*[.C11] -> 1.488
A12: U | B12: AD8532 | C12: 3 | D12: U1, U2, U3 | E12: SOIC-8_3.9x4.9mm_P1.27mm | F12: Analog Devices | G12: Mouser | H12: 584-AD8532ARZ-R7 | I12: 1.49 | J12: of:=[.I12]*[.C12] -> 4.47
B13: AD8531 | C13: 1 | D13: U4 | E13: SOT-23-5 | F13: Analog Devices | G13: Mouser | H13: 584-AD8531ARTZ-R | I13: 0.94 | J13: of:=[.I13]*[.C13] -> 0.94
B14: TC1055 | C14: 1 | D14: U5 | E14: SOT-23-5 | F14: Microchip | G14: Mouser | H14: 579-TC1055-3.3VCT713 | I14: 0.484 | J14: of:=[.I14]*[.C14] -> 0.484
A15: R | B15: 2.2k | C15: 2 | D15: R1, R3 | E15: R_0805_2012Metric | F15: Panasonic | G15: Mouser | H15: 667-ERJ-6ENF2201V | I15: 0.093 | J15: of:=[.I15]*[.C15] -> 0.186
B16: 80k | C16: 5 | D16: R5, R6, R7, R12, R13 | E16: R_0805_2012Metric | F16: Panasonic | G16: Mouser | H16: 667-ERJ-6ENF8062V | I16: 0.093 | J16: of:=[.I16]*[.C16] -> 0.465
B17: 5.1k | C17: 2 | D17: R2, R4 | E17: R_0805_2012Metric | F17: Panasonic | G17: Mouser | H17: 667-ERJ-6ENF5101V | I17: 0.102 | J17: of:=[.I17]*[.C17] -> 0.204
B18: 100k | C18: 4 | D18: R8, R9, R10, R11 | E18: R_0805_2012Metric | F18: Panasonic | G18: Mouser | H18: 667-ERJ-6ENF1003V | I18: 0.112 | J18: of:=[.I18]*[.C18] -> 0.448
B19: 50k | C19: 1 | D19: R14 | E19: R_0805_2012Metric | F19: Panasonic | G19: Mouser | H19: 667-ERJ-6ENF4992V | I19: 0.112 | J19: of:=[.I19]*[.C19] -> 0.112
B20: 10k | C20: 2 | D20: R15, R16 | E20: R_0805_2012Metric | F20: Panasonic | G20: Mouser | H20: 667-ERJ-6ENF1002V | I20: 0.093 | J20: of:=[.I20]*[.C20] -> 0.186
A21: RV | B21: PTV09A-4020F-A504 | C21: 1 | D21: RV1 | E21: PTV09A-4 | F21: Bourns | G21: Mouser | H21: 652-PTV09A-4020FA504 | I21: 0.912 | J21: of:=[.I21]*[.C21] -> 0.912
A22: J | B22: USB4085-GF-A | C22: 1 | D22: J1 | E22: USB_C_Receptacle_GCT_USB4085 | F22: GCT | G22: Mouser | H22: 640-USB4085-GF-A | I22: 0.875 | J22: of:=[.I22]*[.C22] -> 0.875
B23: SJ1-3523N | C23: 1 | D23: J2 | E23: SJ13523N | F23: CUI Devices | G23: Mouser | H23: 490-SJ1-3523N | I23: 1.01 | J23: of:=[.I23]*[.C23] -> 1.01
A24: SW | B24: PCM12SMTR | C24: 1 | D24: SW1 | E24: SW_SPDT_PCM12 | F24: C&K | G24: Mouser | H24: 611-PCM12SMTR | I24: 0.903 | J24: of:=[.I24]*[.C24] -> 0.903
A25: - | B25: PCB_Gmic | C25: 1 | D25: - | E25: - | F25: G.Guillet | G25: - | J25: of:=[.I25]*[.C25] -> 0
H27: Total price : | J27: of:=SUM([.J7:.J25]) -> 16.606
H28: *Depend of the quantity | I28: Price is in CHF